Company,Summary
Samsung Electronics,"Samsung Electronics Co., Ltd. (SEC; stylized as SΛMSUNG; Korean: 삼성전자; lit. 'Tristar Electronics') is a South Korean multinational major appliance and consumer electronics corporation founded in 1969 and headquartered in Yeongtong District, Suwon, South Korea.[1] It is the pinnacle of the Samsung chaebol, accounting for 70% of the group's revenue in 2012,[4] and has played a key role in the group's corporate governance due to cross ownership.[5] It is majority-owned by foreign investors.[6][7]"
ServiceNow,"ServiceNow, Inc. is an American software company that supplies a cloud computing platform for the creation and management of automated business workflows. The company was founded in Santa Clara, California, United States, in 2003 by Fred Luddy. It is listed on the New York Stock Exchange and is a constituent of the S&P 100 and S&P 500 indices.[2]"
Shopify,"Shopify Inc., stylized as shopify, is a Canadian multinational e-commerce company headquartered in Ottawa, Ontario that operates a platform for retail point-of-sale systems. The company has over 5 million customers and processed US$292.3 billion in transactions in 2024, of which 57% was in the United States.[2] Major customers include Tesla, LVMH, Nestlé, PepsiCo, AB InBev, Kraft Heinz, Lindt, Whole Foods Market, Red Bull, and Hyatt.[3]"
Slack Technologies,"Slack Technologies, LLC is an American software company founded in 2009 in Vancouver, British Columbia, known for its proprietary communication platform Slack. Outside its headquarters in San Francisco, California, Slack also operates offices in New York City, Denver, Toronto, London, Paris, Tokyo, Dublin, Vancouver, Pune, and Melbourne.[5][4]: 66"
Snap Inc.,"Snap Inc. is an American technology company, founded on September 16, 2011, by Evan Spiegel, Bobby Murphy, and Reggie Brown, based in Santa Monica, California. The company developed and maintains technological products and services, namely Snapchat, Spectacles, Bitmoji, and SnapBoost. The company was named Snapchat Inc. at its inception, but it was rebranded Snap Inc. on September 24, 2016, to include the Spectacles product under the company name.[13]"
Snowflake Inc.,"Snowflake Inc. is an American cloud-based data platform company founded in San Mateo, California, and headquartered in Menlo Park. It operates a platform that supports data analysis and simultaneous access to data sets with minimal latency.[1] It operates on Amazon Web Services, Microsoft Azure, and Google Cloud Platform."
Sony,"Sony Group Corporation,[b] commonly referred to as Sony,[c] is a Japanese multinational conglomerate headquartered at Sony City in Minato, Tokyo, Japan.[6] The Sony Group encompasses various businesses, including electronics, imaging and sensing (Sony Semiconductor Solutions), film and television (Sony Pictures Entertainment), music (Sony Music Group and Sony Music Entertainment Japan), video games (Sony Interactive Entertainment), and others."
SpaceX,"Space Exploration Technologies Corporation, doing business as SpaceX (stylized as SPACEX in upper caps), is a private American aerospace and artificial intelligence company headquartered at the Starbase development site in Starbase, Texas.[9] Since its founding in 2002, the company has made numerous advances in rocket propulsion, reusable launch vehicles, human spaceflight and satellite constellation technology. As of 2026[update], SpaceX conducts more orbital launches annually than any other launch provider, including private competitors and national programs like the Chinese space program.[10] SpaceX, NASA, and the United States Armed Forces work closely together by means of governmental contracts.[11]"
Spotify,"Spotify[a] is a Swedish audio streaming and media service provider founded in April 2006 by Daniel Ek and Martin Lorentzon.[5] As of December 2025[update], it was one of the largest providers of music streaming services, with over 751 million monthly active users comprising 290 million paying subscribers.[6] Spotify is listed on the New York Stock Exchange in the form of American depositary receipts."
Stripe,"Stripe, striped, or stripes may refer to:"
Tencent,Tencent (Chinese: 腾讯; pinyin: Téngxùn) is a Chinese multinational technology conglomerate and holding company headquartered in Shenzhen. It is one of the highest grossing multimedia companies in the world based on revenue. It is also the world's largest company in the video game industry based on its equity investments. Its associated stock-market-listed variable interest entity Tencent Holdings Ltd is incorporated in the Cayman Islands.
Tesla Inc.,"Tesla, Inc. (/ˈtɛzlə/ TEZ-lə or /ˈtɛslə/ ⓘ TESS-lə[a]) is an American multinational automotive and clean energy company. Headquartered in Austin, Texas, it designs, manufactures, and sells battery electric vehicles (BEVs), stationary battery energy storage devices from home to grid-scale, solar panels and solar shingles, and related products and services."
Twilio,"Twilio Inc. is an American cloud communications company based in San Francisco, California, which provides programmable communication tools for making and receiving phone calls, sending and receiving text messages, and performing other communication functions using its web service APIs."
Uber,This is an accepted version of this page
Unity Technologies,"Unity Software Inc. (doing business as Unity Technologies or simply Unity)[3] is an American video game software development company based in San Francisco. It was founded in Denmark in August 2004 as Over the Edge I/S[a] and changed its name in 2007. Unity Technologies is best known for the development of Unity, a licensed game engine used to create video games and other applications."
Valve Corporation,"Valve Corporation, also known as Valve Software, is an American video game developer, publisher, hardware, and digital distribution company headquartered in Bellevue, Washington. It is the developer of the software distribution platform Steam and the game franchises Half-Life, Counter-Strike, Portal, Day of Defeat, Team Fortress, Left 4 Dead, and Dota."
VMware,"VMware LLC is an American cloud computing and virtualization technology company headquartered in Palo Alto, California, U.S.[2] On November 22, 2023, Broadcom acquired VMware in a cash-and-stock transaction valued at $69 billion,[3] with the End-User Computing  division of VMware then sold to KKR and rebranded to Omnissa. VMware was the first commercially successful company to virtualize the x86 architecture.[4]"
Xiaomi,"Xiaomi (/ˈʃaʊmi/;[6] Chinese: 小米; pinyin: Xiǎomǐ) is a Chinese multinational corporation and technology company headquartered in Beijing, China. It is best known for its consumer electronics, software, and electric vehicles. It is the third-largest smartphone vendor in the world as of 2025, behind Apple and Samsung,[7] most of which run on the Xiaomi HyperOS (former MIUI) operating system. It has 754.1 million global monthly active users, as of December 2025.[8] The company is ranked 338th and is the youngest company on the Fortune Global 500.[9][10] It has been called the ""Apple of China"".[11]"
Yandex,"Yandex LLC (Russian: Яндекс, romanized: Yandeks, IPA: [ˈjandəks] ⓘ) is a Russian technology company that provides Internet-related products and services including a web browser, search engine, cloud computing, web mapping, online food ordering, streaming media, online shopping, and a ridesharing company."
ZoomInfo,"ZoomInfo Technologies Inc. is a registered data broker in the United States.[2] The company collects and sells personal data, both public and private, through various means of data and web scraping. Information about business entities like companies and departments are also collected and offered.[3][4] This personal information is available for sale to other businesses, which use the collected data for targeted marketing.[5]"
Zoom Video Communications,"Zoom Communications, Inc. (formerly Zoom Video Communications, Inc., commonly shortened to Zoom, and stylized as zoom) is an American communications technology company headquartered in San Jose, California, United States. It is primarily known for the videoconferencing application Zoom."
Zscaler,"Zscaler, Inc. (/ˈziːˌskeɪlər/) is an American cloud security company based in San Jose, California. The company offers cloud-based services to protect enterprise networks and data.[3]"
