Company,Summary
Acer Inc.,"Acer Inc. (/ˈeɪsər/; AY-sər) is a Taiwanese multinational company that produces computer hardware and electronics, headquartered in Xizhi District, New Taipei City, Taiwan. Its products include desktop PCs, laptop PCs (clamshells, 2-in-1s, convertibles and Chromebooks), tablets, servers, storage devices, virtual reality devices, displays, smartphones, televisions and peripherals, as well as gaming PCs and accessories under its Predator brand. As of 2024,[update] Acer is the world's sixth-largest personal computer vendor by unit sales.[4]"
Adobe Inc.,"Adobe Inc. (/əˈdoʊbi/ ⓘ ə-DOH-bee), formerly Adobe Systems Incorporated, is an American multinational computer software company based in San Jose, California. It offers a wide range of programs from web design tools, photo manipulation, and vector creation to video and audio editing, mobile app development, print layout, and animation software."
Airbnb,"Airbnb, Inc. (/ˌɛərbiːɛnˈbiː/ AIR-bee-en-BEE, an abbreviation of its original name, ""Airbed and Breakfast""[5][6]) is an American company operating an online marketplace for short-and-long-term homestays, experiences and services in various countries and regions. It acts as a broker and charges a commission from each booking. Airbnb was founded in 2008 by Brian Chesky, Nathan Blecharczyk, and Joe Gebbia.[7][8]"
Alibaba Cloud,"Alibaba Cloud, also known as Aliyun (Chinese: 阿里云; pinyin: Ālǐyún; lit. 'Ali Cloud'), is a cloud computing company, a subsidiary of Alibaba Group. Alibaba Cloud provides cloud computing services to online businesses and Alibaba's own e-commerce ecosystem. Its international operations are registered and headquartered in Singapore.[1]"
Alibaba Group,"Alibaba Group Holding Limited, branded as Alibaba (/ˌæliˈbɑːbə, ˌɑː-/), is a Chinese multinational technology company specializing in e-commerce, retail, Internet, and technology. Founded on 28 June 1999[1] in Hangzhou, Zhejiang, the company provides consumer-to-consumer (C2C), business-to-consumer (B2C), and business-to-business (B2B) sales services via Chinese and global marketplaces, as well as local consumer, digital media and entertainment, logistics, and cloud computing services. It owns and operates a diverse portfolio of companies around the world in numerous business sectors."
Amazon (company),"Amazon.com, Inc.[1] (doing business as Amazon)[a] is an American multinational technology company engaged in e-commerce, cloud computing, online advertising, digital streaming, and artificial intelligence.[5] Founded in 1994 by Jeff Bezos in Bellevue, Washington,[6] the company originally started as an online marketplace for books but gradually expanded its offerings to include a wide range of product categories, referred to as ""The Everything Store"".[7] Amazon has been described as a Big Tech company.[8]"
Apple Inc.,"Apple Inc. is an American multinational technology company headquartered in Cupertino, California, in Silicon Valley, best known for its consumer electronics, software and online services. Founded in 1976 as Apple Computer Company by Steve Jobs, Steve Wozniak and Ronald Wayne, the company was incorporated by Jobs and Wozniak as Apple Computer, Inc. the following year. It was renamed to its current name in 2007 as the company had expanded its focus from computers to consumer electronics. Apple is one of the Big Tech companies."
ASUS,This is an accepted version of this page
Atlassian,"Atlassian Corporation (/ətˈlæsiən/) is an Australian-American proprietary software company that specialises in collaboration tools designed primarily for software development and project management. Founded in Sydney in 2002 and domiciled in the United States since 2022[6][7] as Atlassian Corporation Plc.,[6][7] the company is globally headquartered in Sydney, Australia, with a US headquarters in San Francisco,[8][9] and over 12,000 employees across 14 countries.[10][11][12][13] Atlassian currently serves over 300,000 customers in over 200 countries and territories around the world.[14]"
Autodesk,"Autodesk, Inc. is an American  multinational software corporation that provides software products and services for the architecture, engineering, construction, manufacturing, media, education, and entertainment industries. Autodesk is headquartered in San Francisco, California,[2] and has offices worldwide. Its U.S. offices are located in the states of California, Oregon, Colorado, Texas, Michigan,  New Hampshire and Massachusetts. Its Canadian offices are located in the provinces of Ontario, Quebec, Alberta, and British Columbia."
Baidu,"Baidu, Inc. (/ˈbaɪduː/ BY-doo; Chinese: 百度; pinyin: Bǎidù; lit. 'hundred degrees') is a Chinese multinational technology company specializing in Internet services and artificial intelligence. It holds a dominant position in China's search engine market (via Baidu Search), and provides a wide variety of other internet services such as Baidu App (Baidu's flagship app for search and newsfeed), Baidu Baike (an online user created Wikipedia-like encyclopedia), iQIYI (a video streaming service), and Baidu Tieba (a forum platform similar to Reddit and they made ES File Explorer."
BlackBerry,"BlackBerry (BB) is a discontinued brand of mobile devices and related mobile services, originally developed and maintained by the Canadian company Research In Motion (RIM, later known as BlackBerry Limited) until 2016.[1] The first BlackBerry was a two-way pager, Inter@ctive Pager 950, launched in 1999 in North America, running on the Mobitex network (later also DataTAC)[2][3] and became very popular because of its ""always on"" state and ability to send and receive email messages wirelessly. The BlackBerry pioneered push notifications and popularized the practice of ""thumb typing"" using its QWERTY keyboard, something that would become a trademark feature of the line.[4][5]"
ByteDance,"ByteDance is a Chinese internet technology company headquartered in Haidian, Beijing. Its associated variable-interest entity ByteDance Ltd is incorporated in the Cayman Islands.[6]"
Cisco Systems,"Cisco Systems, Inc. (using the trademark Cisco) is an American multinational technology conglomerate corporation that develops, manufactures, and sells hardware, software, telecommunications equipment and other high-technology services and products focused on networking, cyber security and AI.[4] Cisco specializes in specific tech markets, such as the Internet of things (IoT), domain security, videoconferencing, and energy management, including products such as Webex, OpenDNS, Jabber, and Jasper. The company is headquartered in San Jose, California, and, as of December 2025, has a market capitalization of $317 billion.[5]"
Cloudflare,"Cloudflare, Inc. is an American technology company headquartered in San Francisco, California, that provides a range of internet services, including content delivery network (CDN) services, cloud cybersecurity, DDoS mitigation, and ICANN-accredited domain registration.[3] The company's services act primarily as a reverse proxy between website visitors and a customer's hosting provider, improving performance and protecting against malicious traffic.[4]"
Databricks,"Databricks, Inc. is an American software company based in San Francisco.[4] It was founded in 2013 by the original creators of Apache Spark.[1][5] It offers a cloud-based platform for data analytics and artificial intelligence.[6]"
Dell Technologies,"Dell Technologies Inc. is an American multinational technology company that has been headquartered in Round Rock, Texas since 1994.[3] It was formed as a result of the September 2016 merger of Dell and EMC Corporation.[4] Dell Technologies ranked 48th on the 2024 Fortune 500 rankings of the largest United States corporations based on its 2023 revenue;[5] its products include personal computers, servers, monitors, computer software, computer security and network security, as well as information security services.[4]"
DigitalOcean,"DigitalOcean Holdings, Inc. is an American multinational technology company and cloud service provider. The company is headquartered in Broomfield, Colorado, US, with 15 globally distributed data centers.[5] DigitalOcean provides developers, startups, and SMBs with cloud infrastructure-as-a-service platforms.[6][7]"
Dropbox,"Dropbox is a file hosting service operated by the American company Dropbox, Inc., headquartered in San Francisco, California, that offers cloud storage, file synchronization, personal cloud, and client software. Dropbox was founded in 2007 by MIT students Drew Houston and Arash Ferdowsi as a startup company, with initial funding from seed accelerator Y Combinator.[13]"
Elastic N.V.,"Elastic is a Dutch-American software company that provides a platform for enterprise search, observability, and cybersecurity.[2] Its product enables users to search and analyze large-scale data, monitor system performance, and detect anomalies. Originally known as Elasticsearch, the company was founded in 2012 in Amsterdam, Netherlands, and has maintained its operational headquarters in both the Netherlands and San Francisco, California, US.[3][4] Elastic is publicly traded on the New York Stock Exchange under the symbol ESTC.[5]"
Electronic Arts,"Electronic Arts Inc. (EA) is an American video game company headquartered in Redwood City, California. Founded in May 1982 by former Apple employee Trip Hawkins, the company was a pioneer of the early home computer game industry and promoted the designers and programmers responsible for its games as ""software artists"". EA published numerous games and some productivity software for personal computers, all of which were developed by external individuals or groups until 1987's Skate or Die! The company shifted toward internal game studios, often through acquisitions, such as Distinctive Software becoming EA Canada in 1991.[2]"
Epic Games,"Epic Games, Inc. is an American video game and software developer and publisher based in Cary, North Carolina. The company was founded by Tim Sweeney as Potomac Computer Systems in 1991, originally located in his parents' house in Potomac, Maryland. Following its first commercial video game release, ZZT (1991), the company became Epic MegaGames, Inc. in early 1992 and brought on Mark Rein, who has been its vice president since. After moving the headquarters to Cary in 1999, the studio changed its name to Epic Games."
Ericsson,"Telefonaktiebolaget LM Ericsson (lit. 'Telephone Stock Company of LM Ericsson'), commonly known as Ericsson (Swedish pronunciation: [ˈêːrɪkˌsɔn] ⓘ), is a Swedish multinational networking and telecommunications company headquartered in Stockholm. Ericsson has been a major contributor to the development of the telecommunications industry and is one of the leaders in 5G.[2] Ericsson has over 57,000 granted patents,[3] and it is the inventor of Bluetooth technology.[4]"
Fortinet,"Fortinet, Inc. is an American cybersecurity company headquartered in Sunnyvale, California. It develops and sells security products including firewalls, endpoint security and intrusion detection systems. Fortinet has offices in the US, Canada, and UK.[3]"
GitHub,"GitHub (/ˈɡɪthʌb/ ⓘ) is a proprietary developer platform that allows developers to create, store, manage, and share their code. It uses Git to provide distributed version control and GitHub itself provides access control, bug tracking, software feature requests, task management, continuous integration, and wikis for every project.[9] GitHub, headquartered in San Francisco, is operated by Github, Inc., a subsidiary of Microsoft since 2018.[10]"
GitLab,GitLab is a software forge primarily developed by GitLab Inc. It is available as a community edition and a commercial edition.
GoDaddy,"GoDaddy Inc. is an American publicly traded Internet domain registry, domain registrar and web hosting company[3] headquartered in Tempe, Arizona, and incorporated under the Delaware General Corporation Law.[4] As of 2023,[update] GoDaddy is the world's fifth largest web host by market share,[5][6] with over 62 million registered domains.[7] The company primarily serves small and micro companies, which make up most of its 20 million customers.[8]"
Google,"Google LLC (/ˈɡuː.ɡəl/ ⓘ, GOO-gəl) is an American multinational technology corporation focused on information technology, online advertising, search engine technology, email, cloud computing, software, quantum computing, e-commerce, consumer electronics, and artificial intelligence (AI).[9] It has been referred to as ""the most powerful company in the world"" by the BBC,[10] and is one of the world's most valuable brands.[11][12][13] Google's parent company Alphabet Inc. has been described as a Big Tech company."
HP Inc.,"HP Inc. is an American multinational information technology company with its headquarters in Palo Alto, California, that develops personal computers (PCs), printers and related supplies, as well as 3D printing services. It is the world's second-largest personal computer vendor by unit sales after Lenovo and ahead of Dell as of 2024[update].[2]"
Huawei,"Huawei Technologies Co., Ltd. (sometimes stylized as HUAWEI; /ˈhwɑːweɪ/ HWAH-way; Chinese: 华为; pinyin: Huáwéiⓘ) is a Chinese multinational corporation and technology company headquartered in Longgang, Shenzhen, Guangdong. Its main product lines include telecommunications equipment, consumer electronics, electric vehicle autonomous driving systems, and rooftop solar power products. The company was founded in Shenzhen in 1987 by Ren Zhengfei, a veteran officer of the People's Liberation Army (PLA).[3]"
IBM,"International Business Machines Corporation, doing business as IBM (nicknamed Big Blue),[6] is an American multinational technology company headquartered in Armonk, New York, and present in over 175 countries.[7][8] It is a publicly traded company and one of the 30 companies in the Dow Jones Industrial Average.[a][9][10] IBM is the largest industrial research organization in the world, with 19 research facilities across a dozen countries; for 29 consecutive years, from 1993 to 2021, it held the record for most annual U.S. patents generated by a business."
IBM Watson,"IBM Watson is a computer system capable of answering questions posed in natural language.[1] It was developed as a part of IBM's DeepQA project by a research team, led by principal investigator David Ferrucci.[2] Watson was named after IBM's founder and first CEO, industrialist Thomas J. Watson.[3][4]"
Intel,"Intel Corporation is an American multinational technology company headquartered in Santa Clara, California. It designs, manufactures, and sells computer components such as central processing units (CPUs) and related products for business and consumer markets. Intel was the world's third-largest semiconductor chip manufacturer by revenue in 2024 and has been included in the Fortune 500 list of the largest United States corporations by revenue since 2007. It was one of the first companies listed on Nasdaq."
Intuit,"Intuit Inc. is an American multinational business software company that specializes in financial software. Headquartered in Mountain View, California, the company is led by CEO Sasan Goodarzi. Intuit's products include the tax preparation application TurboTax, the small business accounting software QuickBooks, the credit monitoring and personal finance service Credit Karma,[2] and the email marketing platform Mailchimp.[3] As of 2019,[update] more than 95% of its revenue and earnings originated from its operations within the United States.[4] Intuit is listed on the Nasdaq stock exchange and is a component of the Nasdaq-100, S&P 100, and S&P 500 stock market indices."
Lenovo,"Lenovo Group Limited, trading as Lenovo (/ləˈnoʊvoʊ/ lə-NOH-voh, Chinese: 联想; pinyin: Liánxiǎng), is a Hong Kong–based Chinese[9] multinational corporation and technology company specializing in designing, manufacturing, and marketing consumer electronics, personal computers, software, servers, converged and hyperconverged infrastructure solutions, and related services.[10] Their smartphone brand is Motorola Mobility. Its global headquarters are in Beijing, China, and Morrisville, North Carolina, in the United States; [3][11][12] it has research centers at these locations, elsewhere in China, Hong Kong and Taiwan, in Stuttgart, Germany, and in Yamato, Kanagawa, Japan.[13][14]"
LG Electronics,"LG Electronics Inc. (Korean: 엘지 전자; RR: Elji Jeonja) is a South Korean multinational major appliance and consumer electronics corporation headquartered in Yeouido-dong, Seoul, South Korea. LG Electronics is a part of LG Corporation, the fourth largest chaebol in South Korea, and often considered as the pinnacle of LG Corp with the group's chemical and battery division LG Chem. It comprises four business units: home entertainment, mobility, home appliances & air solutions, and business solutions. LG Electronics acquired Zenith in 1995 and is the largest shareholder of LG Display, the world's largest display company by revenue in 2020.[citation needed] LG Electronics is also the world's second largest television manufacturer behind Samsung Electronics. The company has 128 operations worldwide, employing 83,000 people.[3]"
LinkedIn,"LinkedIn (/lɪŋktˈɪn/) is an American business and employment-oriented social networking service used globally. The platform is primarily used for professional networking and career development, as it allows jobseekers to post their CVs and employers to post their job listings. As of 2026, LinkedIn has more than 1.2 billion registered members from over 200 countries and territories.[4] It was launched on May 5, 2003, by Reid Hoffman and Eric Ly,[5] receiving financing from numerous venture capital firms, including Sequoia Capital, in the years following its inception. Users can invite other people to become connections on the platform, regardless of whether the invitees are already members of LinkedIn. LinkedIn can also be used to organize offline events, create and join groups, write articles, and post photos and videos.[6]"
Meta Platforms,"Meta Platforms, Inc. (doing business as Meta) is an American multinational technology company headquartered in Menlo Park, California. Meta owns and operates several prominent social media platforms and communication services, including Facebook, Instagram, WhatsApp, Messenger, Threads, and Manus. The company also operates an advertising network for its own sites and third parties; as of 2023[update], advertising accounted for 97.8 percent of its total revenue.[9] Meta has been described as a part of Big Tech, which refers to the largest six tech companies in the United States, Alphabet (Google), Amazon, Apple, Meta (Facebook), Microsoft, and Nvidia, which are also the largest companies in the world by market capitalization.[10][11][12]"
Microsoft,"Microsoft Corporation is an American multinational technology company headquartered in Redmond, Washington. The company became influential in the rise of personal computers through software like Windows and has since expanded into areas such as Internet services, cloud computing, artificial intelligence, video gaming, and more. A Big Tech company, Microsoft is the largest software company by revenue, one of the most valuable public companies, and one of the most valuable brands globally."
Netflix,Netflix is an American subscription video on-demand over-the-top streaming television service. The service primarily distributes original and acquired films and television shows from various genres. It is available internationally in multiple languages.[6]
Nintendo,"Nintendo Co., Ltd.[c] is a Japanese multinational video game company headquartered in Kyoto. It develops, publishes, and manufactures both video games and video game consoles."
Nokia,"Nokia Corporation[6][a] is a Finnish multinational telecommunications, information technology, and consumer electronics corporation, originally established as a pulp mill in 1865. Nokia's main headquarters are in Espoo, Finland, in the Helsinki metropolitan area,[4] but the company's actual roots are in the Tampere region of Pirkanmaa.[7] In 2020, Nokia employed approximately 92,000 people[8] across over 100 countries, did business in more than 130 countries, and reported annual revenues of around €23 billion.[5] Nokia is a public limited company listed on the Nasdaq Helsinki and New York Stock Exchange.[9] It was the world's 415th-largest company measured by 2016 revenues, according to the Fortune Global 500, having peaked at 85th place in 2009.[10] It is a component of the Euro Stoxx 50 stock market index.[11][12]"
NVIDIA,"Nvidia Corporation[a] (/ɛnˈvɪdiə/ en-VID-ee-ə) is an American technology company headquartered in Santa Clara, California. The company develops graphics processing units (GPUs), systems on chips (SoCs), and application programming interfaces (APIs) for data science, high-performance computing, video games, and mobile and automotive applications.[5][6] Founded in 1993 by Jensen Huang, Chris Malachowsky, and Curtis Priem, Nvidia has been widely described as a Big Tech company."
Nvidia Corporation,"Nvidia Corporation[a] (/ɛnˈvɪdiə/ en-VID-ee-ə) is an American technology company headquartered in Santa Clara, California. The company develops graphics processing units (GPUs), systems on chips (SoCs), and application programming interfaces (APIs) for data science, high-performance computing, video games, and mobile and automotive applications.[5][6] Founded in 1993 by Jensen Huang, Chris Malachowsky, and Curtis Priem, Nvidia has been widely described as a Big Tech company."
Okta,"In meteorology, an okta is a scale of measurement used to describe the amount of cloud cover at any given location such as a weather station. Sky conditions are estimated in terms of how many eighths of the sky are covered in cloud, ranging from 0 oktas (completely clear sky) through to 8 oktas (completely overcast). In  addition, in the SYNOP code there is an extra cloud cover indicator '9' indicating that the sky is totally obscured (i.e. hidden from view), usually due to dense fog or heavy snow.[1]"
Oracle Cloud,"Oracle Cloud is a cloud computing service offered by Oracle Corporation providing servers, storage, network, applications and services through a global network of Oracle Corporation managed data centers. The company allows these services to be provisioned on demand over the Internet."
Oracle Corporation,"Oracle Corporation is an American multinational technology company headquartered in Austin, Texas.[5] Co-founded in Santa Clara, California in 1977 by Bob Miner, Ed Oates, and current chairman of the board and chief technology officer Larry Ellison,[6][7][8] Oracle is among the 20 largest companies in the world[9] by market cap, and ranked 66th[10] on the Forbes Global 2000 as of 2025."
Palantir Technologies,This is an accepted version of this page
PayPal,"PayPal Holdings, Inc. is an American multinational financial technology company operating an online payments system in the majority of countries that support online money transfers; it serves as an electronic alternative to traditional paper methods such as checks and money orders. The company operates as a payment processor for online vendors, auction sites and many other commercial and company users."
Pinterest,"Pinterest is an American social media service for publishing and discovery of information[4] in the form of digital pinboards.[5] This includes recipes, home, style, motivation, and inspiration on the Internet using image sharing.[6] Pinterest, Inc. was founded by Ben Silbermann, Paul Sciarra, and Evan Sharp,[7] and is headquartered in San Francisco.[‡ 2]"
Qualcomm,"Qualcomm Incorporated (/ˈkwɒlkɒm/)[2] is an American multinational technology corporation headquartered in San Diego, California.[3]The company develops and designs technologies for global communications and computing, including next-generation mobile networks, smart devices, and semiconductors — such as mobile processors and artificial intelligence chips. The company holds essential patents for global mobile communication standards including 5G, 4G,[4] CDMA2000, TD-SCDMA and WCDMA."
Razer Inc.,"Razer Inc. is an American-Singaporean multinational corporation and technology company that manufactures, develops, and markets gaming-focused computer hardware and other consumer electronics as well as financial services."
Red Hat,"Red Hat, Inc. (formerly Red Hat Software, Inc.) is an American software company that provides open source software products to enterprises[5] and is a subsidiary of IBM. Founded in 1993, Red Hat has its corporate headquarters in Raleigh, North Carolina, with other offices worldwide."
RingCentral,"RingCentral, Inc. is an American provider of cloud-based communication and collaboration products and services.[4][5][6][7][8] The company is headquartered in Belmont, California with other US offices in Denver, Charlotte, and Dallas. It has international offices in Canada, the UK, France, Bulgaria, Spain, China, India, the Netherlands, Israel, Australia, South Korea, Switzerland, Germany, Ireland, and the Philippines.[9][better source needed]"
Salesforce,"Salesforce, Inc., is an American cloud-based software company headquartered in San Francisco, California. It provides applications focused on sales, customer service, marketing automation, e-commerce, analytics, artificial intelligence, agentic AI, and application development."
